{
  "$schema": "../schemas/benchmark-research-provenance.schema.json",
  "object": "benchmark_research_provenance",
  "schema_version": "1",
  "manifest_version": "2026-07-15.1",
  "families": [
    {
      "benchmark_family_id": "livecodebench",
      "checked_on": "2026-07-09",
      "sources": [
        {"source_id": "repository", "kind": "official_repository", "url": "https://github.com/LiveCodeBench/LiveCodeBench"},
        {"source_id": "leaderboard", "kind": "official_leaderboard", "url": "https://livecodebench.github.io/leaderboard.html"},
        {"source_id": "current-data", "kind": "official_dataset", "url": "https://livecodebench.github.io/performances_generation.json"}
      ],
      "claims": [
        {
          "topic": "version_status",
          "research_flag": null,
          "basis": "direct_source",
          "statement": "The official leaderboard page selects performances_generation.json as the current release_v6 data artifact.",
          "source_ids": ["repository", "leaderboard", "current-data"]
        }
      ]
    },
    {
      "benchmark_family_id": "aider-polyglot",
      "checked_on": "2026-07-10",
      "sources": [
        {"source_id": "leaderboard", "kind": "official_leaderboard", "url": "https://aider.chat/docs/leaderboards/"},
        {"source_id": "results", "kind": "official_dataset", "url": "https://github.com/Aider-AI/aider/blob/main/aider/website/_data/polyglot_leaderboard.yml"},
        {"source_id": "repository", "kind": "official_repository", "url": "https://github.com/Aider-AI/aider"}
      ],
      "claims": [
        {
          "topic": "scope",
          "research_flag": null,
          "basis": "evalrank_inference",
          "statement": "The result artifact identifies an Aider version, edit format, command, and model, so EvalRank treats each row as an agent system configuration rather than a direct-prompt model result.",
          "source_ids": ["results", "repository"]
        }
      ]
    },
    {
      "benchmark_family_id": "bigcodebench",
      "checked_on": "2026-07-09",
      "sources": [
        {"source_id": "repository", "kind": "official_repository", "url": "https://github.com/bigcode-project/bigcodebench"}
      ],
      "claims": []
    },
    {
      "benchmark_family_id": "scicode",
      "checked_on": "2026-07-09",
      "sources": [
        {"source_id": "site", "kind": "official_site", "url": "https://scicode-bench.github.io/"}
      ],
      "claims": []
    },
    {
      "benchmark_family_id": "swe-bench-live",
      "checked_on": "2026-07-09",
      "sources": [
        {"source_id": "leaderboard", "kind": "official_leaderboard", "url": "https://swe-bench-live.github.io/"}
      ],
      "claims": []
    },
    {
      "benchmark_family_id": "terminal-bench-2-1",
      "checked_on": "2026-07-15",
      "sources": [
        {"source_id": "release", "kind": "official_site", "url": "https://www.tbench.ai/news/terminal-bench-2-1"},
        {"source_id": "leaderboard", "kind": "official_leaderboard", "url": "https://www.tbench.ai/leaderboard/terminal-bench/2.1"},
        {"source_id": "website_client", "kind": "official_repository", "url": "https://github.com/harbor-framework/terminal-bench-docs/blob/3bfb689d4c19642107ce8c1d4a04f1360d45f78e/app/%28home%29/leaderboard/hub/fetch.ts"},
        {"source_id": "harbor_client", "kind": "official_repository", "url": "https://github.com/harbor-framework/harbor/blob/d3e606d9f7d1e111bb22d3d820ebed03ec300eb3/src/harbor/hub/leaderboards.py"},
        {"source_id": "repository", "kind": "official_repository", "url": "https://github.com/harbor-framework/terminal-bench-2-1"},
        {"source_id": "schema_migration", "kind": "official_repository", "url": "https://github.com/harbor-framework/terminal-bench-2-1/commit/a0c400b1138e8c2272c2fc7daa4fa35199b43bef"},
        {"source_id": "signed_labels_migration", "kind": "official_repository", "url": "https://github.com/harbor-framework/terminal-bench-2-1/commit/67f1daf5b331fd10f5e8bc05bfc626aac26eeb39"}
      ],
      "claims": [
        {
          "topic": "scope",
          "research_flag": null,
          "basis": "direct_source",
          "statement": "The official website publishes the display leaderboard while the Apache-2.0 repository pins the 89-task methodology and current merged submissions.",
          "source_ids": ["repository", "leaderboard"]
        },
        {
          "topic": "scope",
          "research_flag": null,
          "basis": "evalrank_inference",
          "statement": "On 2026-07-15, EvalRank's read-only source comparison found every published row matched one current repository submission and repository-only submissions represented unpublished history.",
          "source_ids": ["leaderboard", "repository"]
        },
        {
          "topic": "version_status",
          "research_flag": null,
          "basis": "direct_source",
          "statement": "The pinned official website and Harbor clients document anonymous leaderboard-read access for the public Terminal-Bench 2.1 board.",
          "source_ids": ["website_client", "harbor_client"]
        },
        {
          "topic": "version_status",
          "research_flag": null,
          "basis": "direct_source",
          "statement": "The pinned repository migrations define the current-only boundary: judge_url was removed when hack metrics were introduced, and the later migration introduced signed hack labels.",
          "source_ids": ["schema_migration", "signed_labels_migration"]
        },
        {
          "topic": "scope",
          "research_flag": null,
          "basis": "evalrank_inference",
          "statement": "The current-schema adapter joins the anonymous leaderboard response to an exact repository commit, excludes repository-only history from observations, and covers no trajectories.",
          "source_ids": ["leaderboard", "repository", "schema_migration", "signed_labels_migration"]
        }
      ]
    },
    {
      "benchmark_family_id": "swe-lancer",
      "checked_on": "2026-07-09",
      "sources": [
        {"source_id": "repository", "kind": "official_repository", "url": "https://github.com/openai/SWELancer-Benchmark"}
      ],
      "claims": []
    },
    {
      "benchmark_family_id": "swe-rebench",
      "checked_on": "2026-07-09",
      "sources": [
        {"source_id": "site", "kind": "official_site", "url": "https://swe-rebench.com/about"}
      ],
      "claims": []
    },
    {
      "benchmark_family_id": "liveswebench",
      "checked_on": "2026-07-10",
      "sources": [
        {"source_id": "site", "kind": "official_site", "url": "https://liveswebench.ai/"}
      ],
      "claims": [
        {
          "topic": "scope",
          "research_flag": null,
          "basis": "direct_source",
          "statement": "LiveSWEBench separates autonomous agentic programming, targeted editing, and autocompletion instead of publishing one undifferentiated coding construct.",
          "source_ids": ["site"]
        }
      ]
    },
    {
      "benchmark_family_id": "bfcl-v4",
      "checked_on": "2026-07-09",
      "sources": [
        {"source_id": "site", "kind": "official_site", "url": "https://sky.cs.berkeley.edu/project/berkeley-function-calling-leaderboard/"},
        {"source_id": "leaderboard", "kind": "official_leaderboard", "url": "https://gorilla.cs.berkeley.edu/leaderboard.html"},
        {"source_id": "current-data", "kind": "official_dataset", "url": "https://gorilla.cs.berkeley.edu/data_overall.csv"}
      ],
      "claims": [
        {
          "topic": "version_status",
          "research_flag": null,
          "basis": "direct_source",
          "statement": "The official leaderboard script resolves data_overall.csv; the previously assumed raw Git path is not the current data authority.",
          "source_ids": ["leaderboard", "current-data"]
        }
      ]
    },
    {
      "benchmark_family_id": "complexfuncbench",
      "checked_on": "2026-07-09",
      "sources": [
        {"source_id": "paper", "kind": "primary_paper", "url": "https://arxiv.org/abs/2501.10132"}
      ],
      "claims": []
    },
    {
      "benchmark_family_id": "tau2-bench",
      "checked_on": "2026-07-09",
      "sources": [
        {"source_id": "repository", "kind": "official_repository", "url": "https://github.com/sierra-research/tau2-bench"}
      ],
      "claims": []
    },
    {
      "benchmark_family_id": "mcp-universe",
      "checked_on": "2026-07-09",
      "sources": [
        {"source_id": "repository", "kind": "official_repository", "url": "https://github.com/SalesforceAIResearch/MCP-Universe"}
      ],
      "claims": []
    },
    {
      "benchmark_family_id": "mcpmark",
      "checked_on": "2026-07-09",
      "sources": [
        {"source_id": "repository", "kind": "official_repository", "url": "https://github.com/eval-sys/mcpmark"}
      ],
      "claims": []
    },
    {
      "benchmark_family_id": "mcp-bench",
      "checked_on": "2026-07-09",
      "sources": [
        {"source_id": "repository", "kind": "official_repository", "url": "https://github.com/Accenture/mcp-bench"}
      ],
      "claims": []
    },
    {
      "benchmark_family_id": "webarena-verified",
      "checked_on": "2026-07-09",
      "sources": [
        {"source_id": "site", "kind": "official_site", "url": "https://servicenow.github.io/webarena-verified/"}
      ],
      "claims": []
    },
    {
      "benchmark_family_id": "online-mind2web",
      "checked_on": "2026-07-09",
      "sources": [
        {"source_id": "repository", "kind": "official_repository", "url": "https://github.com/OSU-NLP-Group/Online-Mind2Web"}
      ],
      "claims": []
    },
    {
      "benchmark_family_id": "browsecomp-plus",
      "checked_on": "2026-07-09",
      "sources": [
        {"source_id": "repository", "kind": "official_repository", "url": "https://github.com/texttron/BrowseComp-Plus"}
      ],
      "claims": []
    },
    {